{
  "$schema": "./AI选策略语义数据图谱Schema.json",
  "kind": "ai_strategy_semantic_data_graph",
  "schemaVersion": "1.0.0",
  "catalogVersion": "proposal-2026-08-08-benchmark-bucket-v2",
  "status": "proposal",
  "scope": {
    "datasetId": "page.strategy_wide",
    "datasetName": "AI选策略页面策略宽表",
    "sourceArtifact": "结果文件/最小发布集/basic_data/data/strategy_list_pack.js.gz",
    "physicalFieldsOnly": true,
    "virtualFieldsPolicy": "existing_runtime_only",
    "excludedExampleConcepts": ["首次建仓日", "建仓日期"]
  },
  "datasetProfile": {
    "asOf": "2026-08-07T03:41:00+08:00",
    "rowCount": 1305,
    "physicalFieldCount": 145,
    "virtualFieldCount": 13,
    "dictionaryDescribedFieldCount": 112,
    "dictionaryMissingFieldCount": 33,
    "coverageSummary": {
      "overallNonEmptyRate": 0.8506804069,
      "medianFieldCoverageRate": 0.9379310345,
      "coverage100FieldCount": 61,
      "coverage90To100FieldCount": 32,
      "coverage50To90FieldCount": 36,
      "coverage20To50FieldCount": 0,
      "coverage5To20FieldCount": 3,
      "coverage0To5FieldCount": 9,
      "emptyFieldCount": 4
    },
    "emptyPhysicalFields": ["母策略ID", "母策略名称", "策略关系类型", "官方业绩来源策略ID"],
    "dictionaryMissingFields": [
      "是否历史接口留档", "母策略ID", "母策略名称", "策略关系类型", "官方业绩来源策略ID", "官方业绩口径",
      "买入指令数", "卖出指令数", "加仓指令数", "减仓指令数", "信号胜率_1月", "信号胜率_3月", "信号胜率_6月", "信号胜率_1年",
      "信号加权方向收益_1月", "信号加权方向收益_3月", "信号加权方向收益_6月", "信号加权方向收益_1年",
      "风险数据截至", "风险来源", "基准结构类型", "可比池说明", "基准资产大类-现金", "基准资产大类-商品",
      "基准资产大类-另类", "detailFile", "searchText", "权益风险档", "波动风险档", "回撤风险档", "风险触发指标", "风险分类依据"
    ]
  },
  "domains": [
    {"id":"governance","label":"治理与展示","description":"策略治理、展示边界、分析资格和口径证据。","retrievalPriority":70},
    {"id":"identity","label":"身份与来源","description":"策略主键、名称、渠道和投顾机构。","retrievalPriority":95},
    {"id":"lifecycle","label":"生命周期","description":"策略成立、运行状态和运作时长。","retrievalPriority":100},
    {"id":"classification","label":"分类标签","description":"产品、业务、地域、主动被动和标签分类。","retrievalPriority":85},
    {"id":"performance","label":"收益业绩","description":"区间收益、累计收益、净值、收益日期和业绩口径。","retrievalPriority":100},
    {"id":"risk","label":"风险指标","description":"回撤、波动、夏普、风险等级及风险证据。","retrievalPriority":100},
    {"id":"holding","label":"持仓与资产暴露","description":"持仓日期、基金数量、资产权重和实体暴露。","retrievalPriority":95},
    {"id":"rebalance","label":"调仓行为","description":"调仓日期、次数、换手率和频率。","retrievalPriority":80},
    {"id":"signal","label":"信号行为","description":"信号事件、指令、胜率和方向收益。","retrievalPriority":75},
    {"id":"benchmark","label":"业绩基准","description":"业绩基准文本、基准资产暴露、分档、可比池和映射质量。","retrievalPriority":100},
    {"id":"fee","label":"费率","description":"投顾费率及费率状态。","retrievalPriority":80},
    {"id":"quality","label":"数据质量","description":"数据完整性、基础数据等级和执行门禁。","retrievalPriority":60},
    {"id":"technical","label":"技术字段","description":"页面详情路径和全文检索聚合字段，不作为普通业务属性。","retrievalPriority":10}
  ],
  "operatorProfiles": [
    {"id":"op.identifier","valueType":"identifier","allowedOperators":["eq","neq","in","not_in","exists","not_exists"],"valueFormat":"字符串主键或代码","normalizationRules":["保持前导零","禁止模糊数值化"]},
    {"id":"op.text","valueType":"text","allowedOperators":["eq","neq","contains","not_contains","in","not_in","exists","not_exists"],"valueFormat":"UTF-8文本","normalizationRules":["去除首尾空白","保留中文专名","实体别名先标准化再匹配"]},
    {"id":"op.enum","valueType":"enum","allowedOperators":["eq","neq","in","not_in","exists","not_exists"],"valueFormat":"字段字典中的标准枚举值","normalizationRules":["模型不得创造枚举值","别名必须映射到已知枚举"]},
    {"id":"op.boolean","valueType":"boolean","allowedOperators":["is_true","is_false","eq","neq","exists","not_exists"],"valueFormat":"true或false","normalizationRules":["是/有/属于归一为true","否/无/不属于归一为false"]},
    {"id":"op.integer","valueType":"integer","allowedOperators":["eq","neq","gt","gte","lt","lte","between","exists","not_exists"],"valueFormat":"十进制整数","normalizationRules":["中文数量词转整数","不接受单位残留"]},
    {"id":"op.number","valueType":"number","allowedOperators":["eq","neq","gt","gte","lt","lte","between","exists","not_exists"],"valueFormat":"十进制数值","normalizationRules":["去除千分位","单位由字段映射决定"]},
    {"id":"op.percent","valueType":"percent","allowedOperators":["eq","neq","gt","gte","lt","lte","between","exists","not_exists"],"valueFormat":"页面宽表百分数值，5%标准化为数值5","normalizationRules":["去除百分号后保留百分点数值","不超过映射为lte","不少于映射为gte"]},
    {"id":"op.date","valueType":"date","allowedOperators":["on","before","after","between","relative_period","exists","not_exists"],"valueFormat":"YYYY-MM-DD","normalizationRules":["相对日期由系统按查询基准时点计算","最近N个月对成立日期默认生成gte边界","禁止把3个月写入日期字段"]},
    {"id":"op.path","valueType":"path","allowedOperators":["exists","not_exists"],"valueFormat":"相对页面路径","normalizationRules":["仅技术校验，不交给普通语义筛选"]},
    {"id":"op.search_text","valueType":"search_text","allowedOperators":["contains","not_contains","exists","not_exists"],"valueFormat":"运行时聚合文本","normalizationRules":["只作召回兜底","不得替代结构化字段精确条件"]}
  ],
  "concepts": [
    {"id":"strategy.governance.status","label":"策略治理状态","domainId":"governance","conceptType":"attribute","description":"策略治理层给出的标准状态。","operatorProfileId":"op.enum","semanticVisibility":"advanced_filter","aliases":["治理状态"],"positiveCues":["治理状态"],"negativeCues":["运作状态"],"confusableWith":["strategy.lifecycle.status"]},
    {"id":"strategy.governance.analysis_group","label":"分析分组","domainId":"governance","conceptType":"attribute","description":"策略在分析流程中的标准分组。","operatorProfileId":"op.enum","semanticVisibility":"advanced_filter","aliases":["分析组"],"positiveCues":["分析分组"],"negativeCues":[],"confusableWith":["strategy.classification.business"]},
    {"id":"strategy.governance.flag","label":"治理布尔标记","domainId":"governance","conceptType":"attribute","description":"测试、信号、目标盈、停止、留档、排名、展示等治理标记的概念族。","operatorProfileId":"op.boolean","semanticVisibility":"conditional","aliases":["治理标记"],"positiveCues":["是否","纳入","展示"],"negativeCues":[],"confusableWith":[]},
    {"id":"strategy.relationship","label":"策略关系","domainId":"governance","conceptType":"attribute","description":"母子策略及策略关系；当前对应字段无值，只登记真实字段并禁用执行。","operatorProfileId":"op.text","semanticVisibility":"audit_only","aliases":["母策略","策略关系"],"positiveCues":["母策略"],"negativeCues":[],"confusableWith":[]},
    {"id":"strategy.governance.rule","label":"治理规则说明","domainId":"governance","conceptType":"evidence","description":"治理判断的规则文本。","operatorProfileId":"op.text","semanticVisibility":"evidence_only","aliases":["治理说明"],"positiveCues":["治理依据"],"negativeCues":[],"confusableWith":[]},
    {"id":"strategy.governance.evidence","label":"分类与展示依据","domainId":"governance","conceptType":"evidence","description":"业务、展示、分类、风险和研报判断的依据文本。","operatorProfileId":"op.text","semanticVisibility":"evidence_only","aliases":["判断依据","分类依据"],"positiveCues":["依据","原因"],"negativeCues":[],"confusableWith":[]},
    {"id":"strategy.governance.display","label":"展示状态","domainId":"governance","conceptType":"attribute","description":"天天当前对客展示及展示状态。","operatorProfileId":"op.enum","semanticVisibility":"advanced_filter","aliases":["对客展示","展示状态"],"positiveCues":["当前展示","对客"],"negativeCues":[],"confusableWith":["strategy.governance.flag"]},
    {"id":"strategy.governance.insight_scope","label":"洞察评价对象","domainId":"governance","conceptType":"attribute","description":"洞察分析的评价对象范围。","operatorProfileId":"op.enum","semanticVisibility":"advanced_filter","aliases":["评价对象"],"positiveCues":["洞察评价"],"negativeCues":[],"confusableWith":[]},
    {"id":"strategy.id","label":"统一策略ID","domainId":"identity","conceptType":"attribute","description":"策略全局统一主键。","operatorProfileId":"op.identifier","semanticVisibility":"direct_filter","aliases":["策略ID","统一ID"],"positiveCues":["ID"],"negativeCues":["代码"],"confusableWith":["strategy.code"]},
    {"id":"strategy.code","label":"策略代码","domainId":"identity","conceptType":"attribute","description":"渠道或业务使用的策略代码。","operatorProfileId":"op.identifier","semanticVisibility":"direct_filter","aliases":["组合代码"],"positiveCues":["代码"],"negativeCues":["统一ID"],"confusableWith":["strategy.id"]},
    {"id":"strategy.name","label":"策略名称","domainId":"identity","conceptType":"attribute","description":"策略对外或业务名称。","operatorProfileId":"op.text","semanticVisibility":"direct_filter","aliases":["组合名称","产品名称"],"positiveCues":["叫做","名称"],"negativeCues":[],"confusableWith":["strategy.advisor","strategy.channel"]},
    {"id":"strategy.channel","label":"渠道","domainId":"identity","conceptType":"attribute","description":"策略所在销售或展示渠道。","operatorProfileId":"op.enum","semanticVisibility":"direct_filter","aliases":["平台","销售渠道"],"positiveCues":["渠道"],"negativeCues":["机构"],"confusableWith":["strategy.advisor"]},
    {"id":"strategy.advisor","label":"投顾机构","domainId":"identity","conceptType":"attribute","description":"提供投资顾问服务的机构。","operatorProfileId":"op.enum","semanticVisibility":"direct_filter","aliases":["投顾公司","机构"],"positiveCues":["投顾机构","由谁管理"],"negativeCues":["销售渠道"],"confusableWith":["strategy.channel"]},
    {"id":"strategy.classification.type","label":"策略类型","domainId":"classification","conceptType":"attribute","description":"披露策略类型或研报产品类型。","operatorProfileId":"op.enum","semanticVisibility":"direct_filter","aliases":["产品类型","策略类别"],"positiveCues":["类型"],"negativeCues":["业务分类"],"confusableWith":["strategy.classification.research","strategy.classification.business"]},
    {"id":"strategy.classification.disclosed_risk","label":"披露风险等级","domainId":"classification","conceptType":"attribute","description":"源渠道披露的风险等级。","operatorProfileId":"op.enum","semanticVisibility":"advanced_filter","aliases":["披露风险"],"positiveCues":["披露的风险等级"],"negativeCues":["系统风险等级"],"confusableWith":["risk.level"]},
    {"id":"strategy.classification.research","label":"研报分类","domainId":"classification","conceptType":"attribute","description":"研报产品类型及股票子类型。","operatorProfileId":"op.enum","semanticVisibility":"advanced_filter","aliases":["研报类型"],"positiveCues":["研报"],"negativeCues":[],"confusableWith":["strategy.classification.type"]},